{"done":true,"completion_percent":99,"current_milestone":"M5 Hardening, docs finais e handoff","summary":"Milestone loop executed from M0 to M5 using the specified codex docs as source of truth, with phases 6 and 7 skipped. Per-milestone validations were run before advancing, AI fallback was implemented/used in mock mode (live credentials unavailable), importable n8n workflows were delivered (`wa-03-real-e2e.json`, `wa-04-ai-mock-or-live.json`), and `docs/codex/Documentation.md` was updated with status, decisions, commands, results, risks, and handoff.","next_actions":["Optional external smoke test in n8n+Meta with real WhatsApp credentials","Optional switch to live AI by setting `AI_MODE=live` and `OPENAI_API_KEY`"],"blockers":[],"ai_mode":"mock"}